{
  "id": "RT-PDF-THE HEIR APPARENT'S BLUEPRINT FOR CAPTURE-01",
  "title": "PDF Analysis Priority: The heir apparent's blueprint for capture (1)",
  "description": "Research priority generated from analysis of PDF document The heir apparent's blueprint for capture.pdf. This represents systematic institutional capture patterns identified in the document content.",
  "priority": 6,
  "status": "pending",
  "category": "pdf-generated",
  "tags": [
    "pdf-analysis",
    "systematic-capture"
  ],
  "estimated_events": 3,
  "actual_events": 0,
  "created_date": "2025-09-06",
  "updated_date": "2025-09-06",
  "estimated_importance": 6
}